2	"Beacon Shape"	1	"stake, pole, perch, post"	"An elongated wood or metal pole, embedded in the bottom to serve as a navigational aid or a support for a navigational aid. (adapted from IHO Dictionary S-32, 5th Edition, 4960)"
2	"Beacon Shape"	2	"withy"	"A tree without roots stuck or spoiled into the bottom of the sea to serve as a navigational aid."
2	"Beacon Shape"	3	"beacon tower"	"A solid structure of the order of 10 metres in height used as a navigational aid."
2	"Beacon Shape"	4	"lattice beacon"	"A structure consisting of strips of metal or wood crossed or interlaced to form a structure to serve as an aid to navigation or as a support for an aid to navigation."
2	"Beacon Shape"	5	"pile beacon"	"A long heavy timber(s) or section(s) of steel, wood, concrete, etc., forced into the seabed to serve as an aid to navigation or as a support for an aid to navigation.(Adapted from IHO Dictionary, S-32, 5th Edition, 3840 and Navigation Dictionary, US National Oceanic and Atmospheric Administration - NOAA, 1969)"
2	"Beacon Shape"	6	"cairn"	"A mound of stones, usually conical or pyramidal, raised specifically for maritime navigation. (adapted from IHO Dictionary, S-32, 5th Edition, 601)."
2	"Beacon Shape"	7	"buoyant beacon"	"A tall spar-like beacon fitted with a permanently submerged buoyancy chamber, the lower end of the body is secured to seabed sinker either by a flexible joint or by a cable under tension. (IHO Specifications, M-4, 459.1)"
3	"Building Shape"	5	"high rise building"	"A building having many storeys. (The New Shorter Oxford English Dictionary, 1993)"
3	"Building Shape"	6	"pyramid"	"A polyhedron of which one face is a polygon of any number of sides, and the other faces are triangles with a common vertex. (The New Shorter Oxford English Dictionary, 1993)"
3	"Building Shape"	7	"cylindrical"	"Shaped like a cylinder, which is a solid geometrical figure generated by straight lines fixed in direction and describing with one of its points a close curve, especially a circle. (The New Shorter Oxford English Dictionary, 1993)"
3	"Building Shape"	8	"spherical"	"Shaped like a sphere, which is a body the surface of which is at all points equidistant from the centre. (The New Shorter Oxford English Dictionary, 1993)"
3	"Building Shape"	9	"cubic"	"A shape the sides of which are six equal squares; a regular hexahedron. (The New Shorter Oxford English Dictionary, 1993)"
4	"Bouy Shape"	1	"conical (nun, ogival)"	"The upper part of the body above the water-line, or the greater part of the superstructure, has approximately the shape or the appearance of a pointed cone with the point upwards."
4	"Bouy Shape"	2	"can (cylindrical)"	"The upper part of the body above the water-line, or the greater part of the superstructure, has the shape of a cylinder, or a truncated cone that approximates to a cylinder, with a flat end uppermost."
4	"Bouy Shape"	3	"spherical"	"The upper part of the body above the water-line, or the greater part of the superstructure, has the shape of a part of a sphere."
4	"Bouy Shape"	4	"pillar"	"The upper part of the body above the water-line, or the greater part of the superstructure is a narrow vertical structure, pillar or lattice tower."
4	"Bouy Shape"	5	"spar (spindle)"	"The upper part of the body above the water-line, or the greater part of the superstructure, has the form of a pole, or of a very long cylinder, floating upright."
4	"Bouy Shape"	6	"barrel (tun)"	"The upper part of the body above the water-line, or the greater part of the superstructure, has the form of a barrel or cylinder floating horizontally."
4	"Bouy Shape"	7	"super-buoy"	"A very large buoy, generally more than 5m in diameter."
4	"Bouy Shape"	8	"ice buoy"	"A specially constructed shuttle shaped buoy which is used in ice conditions."
7	"Category of Airport/airfield"	1	"military aeroplane airport"	"a large military airfield usually equipped with a control tower, hangars and accommodation for the receiving and discharging of passengers or cargo. (adapted from The Macquarie Dictionary, 1988)"
7	"Category of Airport/airfield"	2	"civil aeroplane airport"	"a large airfield usually equipped with a control tower, hangars and accommodation for the receiving and discharging of passengers or cargo. (The Macquarie Dictionary, 1988)"
7	"Category of Airport/airfield"	3	"military heliport"	"a landing place for helicopters controlled by the military."
7	"Category of Airport/airfield"	4	"civil heliport"	"a landing place for helicopters, often the roof of a building. (The Macquarie Dictionary, 1988)"
7	"Category of Airport/airfield"	5	"glider airfield"	"an area of land set aside for the take-off and landing of gliders."
7	"Category of Airport/airfield"	6	"small planes airfield"	"an area of land set aside for the take-off and landing of small aeroplanes."
7	"Category of Airport/airfield"	8	"emergency airfield"	"an area of land set aside for the take-off and landing of aeroplanes or helicopters in times of emergency. (AML)"
7	"Category of Airport/airfield"	501	"Search and Rescue"	"an airfield that is equipped with search and rescue aircraft and facilities (AML)"
8	"Type of Anchorage"	1	"unrestricted anchorage"	"An area in which vessels anchor or may anchor. (IHO Dictionary, S-32, 5th Edition, 130)"
8	"Type of Anchorage"	2	"deep water anchorage"	"An area in which vessels of deep draught, anchor or may anchor. (S-57 Annex A, Appendix A, IHO Object Catalogue)"
8	"Type of Anchorage"	3	"tanker anchorage"	"An area in which tankers anchor or may anchor. (S-57 Annex A, Appendix A, IHO Object Catalogue)"
8	"Type of Anchorage"	4	"explosives anchorage"	"An area set apart for anchored ships discharging or receiving explosives. (IHO Dictionary, S-32, 5th Edition, 1732)"
8	"Type of Anchorage"	5	"quarantine anchorage"	"An area where a vessel anchors when satisfying quarantine regulations. (IHO Dictionary, S-32, 5th Edition, 4117)"
8	"Type of Anchorage"	6	"sea-plane anchorage"	"An area in which sea-planes anchor or may anchor. (S-57 Annex A, Appendix A, IHO Object Catalogue)"
8	"Type of Anchorage"	7	"small craft anchorage"	"An area in which small boats anchor or may anchor. (S-57 Annex A, Appendix A, IHO Object Catalogue)"
8	"Type of Anchorage"	8	"small craft mooring area"	"An area in which yachts and small boats moor. (S-57 Annex A, Appendix A, IHO Object Catalogue)"
8	"Type of Anchorage"	9	"anchorage for periods up to 24 hours"	"An area in which vessels anchor or may anchor for periods of up to 24 hours. (S-57 Annex A, Appendix A, IHO Object Catalogue)"
8	"Type of Anchorage"	10	"Anchorage for a limited period of time"	"An area in which vessels may anchor for a period of time not to exceed a specific limit."
9	"Bridge Classification"	1	"fixed bridge"	"A bridge having permanent horizontal and vertical alignment. (McGraw-Hill Dictionary of Scientific and Technical Terms, 3rd Edition, 1984)"
9	"Bridge Classification"	2	"opening bridge"	"A bridge that is closed when set for carrying road traffic and open when set to permit marine traffic to pass through the waterway it crosses.  (Adapted from McGraw-Hill Encyclopedia of Science and Technology 7th Edition, 1992)"
9	"Bridge Classification"	3	"swing bridge"	"A movable bridge (or span thereof) which rotates in a horizontal plane about a vertical pivot to allow the passage of vessels. (Adapted from McGraw-Hill Encyclopedia of Science and Technology 7th Edition, 1992)"
9	"Bridge Classification"	4	"lifting bridge"	"A movable bridge (or span thereof) which is capable of being lifted vertically to allow vessels to pass beneath. (Adapted from IHO Dictionary, S-32 5th Edition, 547)"
9	"Bridge Classification"	5	"bascule bridge"	"A counterpoise bridge rotated in a vertical plane about an axis at one or both ends.  Also called a balance. (IHO Dictionary S-32, 5th Edition, 545)"
9	"Bridge Classification"	6	"pontoon bridge"	"A fixed floating bridge supported by pontoons. (McGraw-Hill Dictionary of Scientific and Technical Terms, 3rd Edition, 1984)"
9	"Bridge Classification"	7	"draw bridge"	"A general name for bridges of which part or the entire span of the bridge may be raised or drawn aside to allow ships to pass through. (IHO Dictionary S-32, 5th Edition, 546)"
9	"Bridge Classification"	8	"transporter bridge"	"A bridge that has towers on each side of the waterway connected by a girder system on which a carriage runs. (IHO Chart Specifications, M-4, 381.2)"
9	"Bridge Classification"	9	"foot bridge"	"A bridge structure used only for pedestrian traffic. (McGraw-Hill Dictionary of Scientific and Technical Terms, 3rd Edition, 1984)"
9	"Bridge Classification"	10	"viaduct"	"A long bridge consisting of a series of beams, spans or girders (of steel, timber or concrete) supported on towers or piers and used to carry a road, railroad, etc. (Adapted from McGraw-Hill Encyclopedia of Science and Technology 7th Edition, 1992)"
9	"Bridge Classification"	11	"aqueduct"	"A bridge supporting an artificially elevated channel, for the conveyance of water. (Adapted from The New Shorter Oxford English Dictionary, 1993)"
9	"Bridge Classification"	12	"suspension bridge"	"A fixed bridge consisting of either a roadway or a truss suspended from two or more cables which pass over towers and are anchored by backstays to a firm foundation. (Adapted from McGraw-Hill Encyclopedia of Science and Technology 7th Edition, 1992)"
10	"Type of Built-up Area"	1	"urban area"	"An area predominantly occupied by man-made structures used for residential, commercial and industrial purposes. (Nautical Chart Manual, US Department of Commerce, 1992)"
10	"Type of Built-up Area"	2	"settlement"	"A small collection of dwellings in a remote area."
10	"Type of Built-up Area"	3	"village"	"A collection of houses in a rural area, usually smaller than a town. (S-57 Annex A, Appendix A, IHO Object Catalogue)"
10	"Type of Built-up Area"	4	"town"	"Any considerable collection of dwellings and other buildings larger than a village, but not incorporated as a city.(S-57 Annex A, Appendix A, IHO Object Catalogue)"
10	"Type of Built-up Area"	5	"city"	"A major town inhabited by a large permanent community with all essential services.(S-57 Annex A, Appendix A, IHO Object Catalogue)"
10	"Type of Built-up Area"	6	"holiday village"	"A collection of smaller houses (cottages, mobile homes etc.) which is mainly populated on a seasonal basis. (S-57 Annex A, Appendix A, IHO Object Catalogue)"
10	"Type of Built-up Area"	501	"native settlement"	
11	"Type of Cable"	1	"power line"	"a cable used for the supply of electricity(S-57 Annex A, Appendix A, IHO Object Catalogue)"
11	"Type of Cable"	3	"transmission line"	"multiple un-insulated cables usually supported by steel lattice towers. Such features are generally more prominent than normal power lines. (S-57 Annex A, Appendix A, IHO Object Catalogue)"
11	"Type of Cable"	4	"telephone"	"a cable used for the transmission of telephone signals. (S-57 Annex A, Appendix A, IHO Object Catalogue)"
11	"Type of Cable"	5	"telegraph"	"a cable used for the transmission of telegraph signals. (S-57 Annex A, Appendix A, IHO Object Catalogue)"
11	"Type of Cable"	6	"mooring cable/chain"	"a cable or chain used to secure a mooring buoy or other floating structure.(S-57 Annex A, Appendix A, IHO Object Catalogue)"
11	"Type of Cable"	501	"data transmission"	"a cable used for the transmission of data.(AML)"
11	"Type of Cable"	502	"fibre optic"	"a cable comprised of multiple bundles of extremely thin flexible glass, transmitting light by total internal reflection. (Adapted from Chambers Concise Dictionary)"
12	"category of canal"	1	"transportation"	"a canal used for navigation as part of a transport system"
12	"category of canal"	2	"drainage"	"a canal used to drain excess water from surrounding land"
12	"category of canal"	3	"irrigation"	"a canal used to supply water for the purpose of irrigation"
13	"Category of Cardinal Mark"	1	"north cardinal mark"	
13	"Category of Cardinal Mark"	2	"east cardinal mark"	
13	"Category of Cardinal Mark"	3	"south cardinal mark"	
13	"Category of Cardinal Mark"	4	"west cardinal mark"	
14	"Category of Checkpoint"	1	"Custom"	"An office, especially in ports, at which customs dues are collected or administrated. (adapted from The New Shorter Oxford English Dictionary, 1993)"
14	"Category of Checkpoint"	501	"RV Location"	"specified location that is identified and used as a rendezvous point (AML)"
15	"Category of Coastline"	1	"steep coast"	"A coast backed by rock or earth cliffs, gives a good radar return and is useful for visual identification from a considerable distance off, where cliffs alternate with low lying coast along the shoreline. (IHO Chart Specifications, M-4)"
15	"Category of Coastline"	2	"flat coast"	"A level coast with no obvious topographic features. (S-57 Annex A, Appendix A, IHO Object Catalogue)"
15	"Category of Coastline"	3	"sandy shore"	"a shoreline area made up of sand, ie. loose material consisting of small but easily distinguishable, separate grains, between 0.0625 and 2.000 millimetres in diameter. (adapted from IHO Dictionary, S-32, 5th Edition, 4497)"
15	"Category of Coastline"	4	"stony shore"	"A shoreline area made up of rock and rock fragments ranging in size from pebbles and gravel to boulders or large rock masses. (adapted from IHO Dictionary, S-32, 5th Edition, 5059)"
15	"Category of Coastline"	5	"shingly shore"	"A shoreline area made up of rounded, often flat water-worn rock fragments larger than approximately 16 mm. (adapted from IHO Dictionary, S-32, 4683)"
15	"Category of Coastline"	6	"glacier (seaward end)"	"Projecting seaward extension of glacier, usually afloat.  Also called glacier tongue. (IHO Dictionary, S-32, 5th Edition 2043)"
15	"Category of Coastline"	7	"mangrove"	"One of several genera of tropical trees or shrubs which produce many prop roots and grow along low lying coasts into shallow water. (IHO Dictionary, S-32, 5th Edition 3064)"
15	"Category of Coastline"	8	"marshy shore"	"A shoreline area made up of spongy land saturated with water. It may have a shallow covering of water, usually with a considerable amount of vegetation appearing above the surface. (adapted from IHO Dictionary, S-32, 5240)"
15	"Category of Coastline"	9	"coral reef"	"A reef, often of large extent, composed chiefly of coral and its derivatives. (IHO Dictionary, S-32, 5th Edition 1063)"
15	"Category of Coastline"	10	"ice coast"	"A vertical cliff forming the seaward edge of an ice shelf, ranging in height from 2m to 50 m or more above sea level."
15	"Category of Coastline"	11	"Shelly Shore"	"A shoreline area made up of shells i.e. made up of the hard outside covering of marine animals."
16	"Class of Control Point"	1	"triangulation point"	"A recoverable point on the earth, whose geographic co-ordinates have been determined by angular methods with geodetic instruments. (Adapted from IHO Dictionary, S-32, 5th Edition, 5646)"
16	"Class of Control Point"	2	"observation spot"	"A point used by surveyors for determining precise position by astronomical means. (IHO Chart Specifications, M-4)"
16	"Class of Control Point"	3	"fixed point"	"A point whose position has been accurately determined and plotted. (IHO Chart Specifications, M-4)"
16	"Class of Control Point"	4	"bench-mark"	"A permanent, stable object containing a marked point of known elevation with respect to a datum used as a reference level for tidal observations or as a control point for levelling. (IHO Dictionary, S-32, 5th Edition, 462)"
16	"Class of Control Point"	5	"boundary mark"	"A marker identifying the location of a surveyed boundary line (Digital Geographic Information Standard - DIGEST, Oct.87)"
16	"Class of Control Point"	6	"horizontal control, main station"	"A station in a network of permanently marked control points having their geographic positions established to form third order accuracy or better. (Canadian Hydrographic Service, Survey Standing Order, 3.1-85)"
16	"Class of Control Point"	7	"horizontal control, secondary station"	"A station in a network of control points of a localised nature utilised for shoreline plots, sounding marks, stadia work, etc., whose geographic position may be established to a slightly lower order than main control points. (Canadian Hydrographic Service, Survey Standing Order, 3.1-85)"
17	"Type of Conveyor"	1	"aerial cableway"	"A conveyor along which material or people are transported by means of overhead cables supporting buckets, cable cars, etc. (S-57 Annex A, Appendix A, IHO Object Catalogue)"
17	"Type of Conveyor"	2	"belt conveyor"	"A conveyor along which material or people are transported by means of a moving belt. (S-57 Annex A, Appendix A, IHO Object Catalogue)"
18	"Category of Coverage"	1	"coverage available"	"continuous coverage of spatial objects is available within this area"
18	"Category of Coverage"	2	"no coverage available"	"an area containing no spatial objects"
19	"category of crane"	2	"container crane/gantry"	"a high speed, shore-based crane used in the lift-on/lift-off operation of specially constructed containers. (adapted from Nautical Chart Manual, US Department of Commerce, Coast and Geodetic Survey, 7th Edition)"
19	"category of crane"	3	"sheerlegs"	"a tripodal structure used in dockyards and harbours for stepping masts or lifting loads in to and out of vessels."
19	"category of crane"	4	"travelling crane"	"a crane mounted on rails (track) that can move (usually parallel to the wharf face) in order to load and unload cargo vessels. (Canadian Hydrographic Service)"
19	"category of crane"	5	"A-frame"	"a type of crane shaped like the letter &gt;A=. They are often positioned on river banks or the coastline and are used for lifting logs from logging trucks and depositing them in the water. (Canadian Hydrographic Service)"
20	"category of dam"	1	"weir"	"a dam erected across a river to raise the level of the water. A fence of stakes setin a river or along the shore as a trap for fish. The word is now restricted to smaller works, the larger are called dams. (IHO Dictionary, S-32, 5th Edition, 5967)"
20	"category of dam"	2	"dam"	"a barrier to check or confine anything in motion; particularly one constructed to hold back water and raise its level to form a reservoir, or to prevent flooding. (IHO Dictionary, S-32, 5th Edition, 1196)"
20	"category of dam"	3	"flood barrage"	"an opening dam across a channel which, when required, is closed to control flood waters. (IHO Chart Specifications, M-4 326.7)"
21	"Category of distance mark"	1	"Distance mark not physically installed"	"A point at which a distance from an origin along a feature is given for information, but at which no specific marker exists."
21	"Category of distance mark"	2	"Visible mark, pole"	"A point at which a distance from an origin along a feature is given for information and which is marked by a pole."
21	"Category of distance mark"	3	"Visible mark, board"	"A point at which a distance from an origin along a feature is given for information and which is marked by a board."
21	"Category of distance mark"	4	"Visible mark, unknown shape"	"A point at which a distance from an origin along a feature is given for information and which is physically marked, but the shape of the mark is not known or not given."
22	"Category of dock"	1	"Tidal"	"A dock which is open to the sea and in which the water level is affected by tides."
22	"Category of dock"	2	"Non-tidal (wet dock)"	"A dock in which water can be maintained at any level by closing a gate when the water is at the desired level. (IHO Dictionary, S-32, 5th Edition, 1429)"
23	"Classification of Dumping Ground"	2	"chemical waste dumping ground"	"An area at sea where chemical waste is dumped. (S-57 Annex A, Appendix A, IHO Object Catalogue)"
23	"Classification of Dumping Ground"	3	"nuclear waste dumping ground"	"An area at sea where nuclear waste is dumped. (S-57 Annex A, Appendix A, IHO Object Catalogue)"
23	"Classification of Dumping Ground"	4	"explosives dumping ground"	"An area at sea where explosives are dumped. (S-57 Annex A, Appendix A, IHO Object Catalogue)"
23	"Classification of Dumping Ground"	5	"spoil ground"	"An area at sea where dredged material is deposited. Also called dumping ground. (IHO Dictionary, S-32, 5th  Edition, 4930)"
23	"Classification of Dumping Ground"	6	"vessel dumping ground"	"An area at sea where disused vessels are scuttled. (S-57 Annex A, Appendix A, IHO Object Catalogue)"
24	"category of fence/wall"	1	"fence"	"a man made barrier used as an enclosure or boundary or for protection. (Digital Geographic Information Working Group -DGIWG, Oct. 1987)"
24	"category of fence/wall"	3	"hedge"	"a continuous growth of shrubbery planted as a fence, a boundary or a wind break. (Digital Geographic Information Standard - DIGEST)"
24	"category of fence/wall"	4	"wall"	"a fence constructed from masonry or stone."
25	"Category of Ferry"	1	"'free moving' ferry"	"a ferry which may have routes that vary with weather, tide and traffic. (adapted from M-4)"
25	"Category of Ferry"	2	"cable ferry"	"a ferry that follows a fixed route guided by a cable. (adapted   from M-4)"
25	"Category of Ferry"	3	"ice ferry"	"a winter-time ferry which crosses a lead. (Finnish Maritime Administration)"
26	"Category of Fishing Facility"	1	"fishing stake"	"a pole or stake placed in shallow water to outline a fishing ground or to catch fish (IHO Dictionary, S-32, 5th Edition, 1818)."
26	"Category of Fishing Facility"	2	"fish trap"	"a structure (usually portable) for catching fish (IHO Dictionary, S-32, 5th Edition, 1819)."
26	"Category of Fishing Facility"	3	"fish weir"	"a fence of stakes or stones set in a river or along the shore to trap fish (IHO Dictionary, S-32, 5th Edition, 5967)."
26	"Category of Fishing Facility"	4	"tunny net"	"a net built at sea for catching tunny (IHO Dictionary, S-32, 5th Edition, 5700)."
27	"Category of Fog Signal"	1	"Explosive"	"A signal produced by the firing of explosive charges. (Admiralty List of Lights and Fog Signals)"
27	"Category of Fog Signal"	2	"Diaphone"	"A diaphone uses compressed air and generally emits a powerful low-pitched sound, which often concludes with a brief sound of suddenly lowered pitch, termed the 'grunt'. (Admiralty List of Lights and Fog Signals)"
27	"Category of Fog Signal"	3	"Siren"	"A siren uses compressed air and exists in a variety of types which differ considerably in their sound and power. (Admiralty List of Lights and Fog Signals)"
27	"Category of Fog Signal"	4	"Nautophone"	"A horn having a diaphragm oscillated by electricity (IHO Dictionary, S-32, 5th Edition, 3371)."
27	"Category of Fog Signal"	5	"Reed"	"A reed uses compressed air and emits a weak, high pitched sound. (Admiralty List of Lights and Fog Signals)"
27	"Category of Fog Signal"	6	"Tyfon"	"A diaphragm horn which operates under the influence of compressed air or steam (IHO Dictionary, S-32, 5th Edition, 5717)."
27	"Category of Fog Signal"	7	"Bell"	"A ringing sound with a short range. The apparatus may be operated automatically, by hand or by wave action. (IHO Chart Specifications, M-4, 452.5)"
27	"Category of Fog Signal"	8	"Whistle"	"A distinctive sound made by a jet of air passing through an orifice. The apparatus may be operated automatically, by hand or by air being forced up a tube by waves acting on a buoy. (IHO Chart Specifications, M-4, 452.6)"
27	"Category of Fog Signal"	9	"Gong"	"A sound produced by vibration of a disc when struck. The apparatus may be operated automatically, by hand or by wave action. (IHO Chart Specifications, M-4, 452.7)"
27	"Category of Fog Signal"	10	"Horn"	"A horn uses compressed air or electricity to vibrate a diaphragm and exists in a variety of types which differ greatly in their sound and power. (Admiralty List of Lights and Fog Signals)"
28	"Type of Fortified Structure"	1	"castle"	"A large fortified building or structure. (Adapted from the Collins Dictionary)"
28	"Type of Fortified Structure"	2	"fort"	"A fortified enclosure, building or position able to be defended against an enemy. (The Collins Dictionary)"
28	"Type of Fortified Structure"	3	"battery"	"A fortified structure on which artillery is mounted. (The Collins Dictionary)"
28	"Type of Fortified Structure"	4	"blockhouse"	"A concrete structure strengthened to give protection against enemy fire, with apertures to allow defensive gunfire. (The Collins Dictionary)"
28	"Type of Fortified Structure"	5	"Martello Tower"	"A round fort for coastal defence. (S-57 Annex A, Appendix A, IHO Object Catalogue)"
28	"Type of Fortified Structure"	6	"Redoubt"	"An outwork or fieldwork usually square or polygonal and without flanking defences. (Concise Oxford Dictionary)."
29	"category of gate"	2	"flood barrage gate"	"an opening gate used to control flood water."
29	"category of gate"	3	"caisson"	"a steel structure used for closing the entrance of locks, wet and dry docks. (IHO Dictionary, S-32, 5th Edition, 602)"
29	"category of gate"	4	"lock gate"	"lock gates are the massive hinged doors at each end of a lock. (adapted from IHO Dictionary, S-32, 5th Edition, 2882)"
29	"category of gate"	5	"dyke gate"	"an opening gate in a dyke."
29	"category of gate"	6	"sluice"	"a sliding gate or other contrivance for changing the level of a body of water by controlling the flow into or out of it. (IHO Dictionary, S-32, 5th Edition, 4783)."
30	"Category of Harbour Facility"	1	"RoRo terminal"	"a terminal for roll-on roll-off ferries."
30	"Category of Harbour Facility"	3	"ferry terminal"	"a terminal for passenger and vehicle ferries."
30	"Category of Harbour Facility"	4	"fishing harbour"	"a harbour with facilities for fishing boats."
30	"Category of Harbour Facility"	5	"yacht harbour/marina"	"a harbour with facilities for small boats and yachts (IHO Dictionary, S-32, 5th Edition, 3095)."
30	"Category of Harbour Facility"	6	"naval base"	"a centre of operations for naval vessels (adapted from The Collins Dictionary)."
30	"Category of Harbour Facility"	7	"tanker terminal"	"a terminal for the bulk handling of liquid cargoes."
