123	"Product"	514	"foodstuffs, solid"	"any substance that a living thing feeds on, that nourishes the body; sustains or promotes growth, wherein the particles firmly cohere. Some foodstuffs may be consumed unprocessed, while others may undergo one or more manufacturing processes to make it palatable, or to allow mixing with other foodstuffs. (AML) Specific examples include: animal feed - substances used as nourishment for livestock. (Adapted from Chambers Concise Dictionary) beans -  the name of several kinds of leguminous plants and their seeds, applied also to the seeds of other plants eg. coffee. (Adapted from Chambers Concise Dictionary) bran - the inner husks of corn sifted from the flour. (Chambers Concise Dictionary) cereal -  grains used as food, such as wheat, barley etc. (Adapted from Collins English Dictionary) cocoa -  a powder made from crushed cacao seeds, often with other ingredients. (Concise Oxford Dictionary Ninth Edition) coffee -  powder made by roasting and grinding the seeds of a tree of the madder family. (Adapted from Chambers Concise Dictionary) flour -  the finely ground meal of wheat or other grain. (Chambers Concise Dictionary) grain - a small hard seed, especially that of any cereal plant such as wheat, rice, corn, rye etc. (adapted from the Webster's New World Dictionary) maize -  a cereal plant, native to N. America, yielding large grains set in rows on a cob. (Adapted from Concise Oxford Dictionary Ninth Edition) nuts - any fruit with an edible seed in a hard shell. (Chambers Concise Dictionary) oilcake - the solid residue that remains after expressing or extracting most of the oil from various seeds and is often ground to make oil meal. (Webster's 3rd New International Dictionary) rape - a plant related to the turnip, brilliantly yellow-flowered, and cultivated for its herbage and oil-producing seeds. (Chambers Concise Dictionary) seed -  a multicellular structure by which flowering plants reproduce, consisting of embryo, stored food and seed-coat. (Chambers Concise Dictionary) sugar -  a sweet substance obtained chiefly from cane and beet. (Chambers Concise Dictionary) tea -  dried leaves of an Asian bush used to make a drink by infusing in hot water. (Adapted from Collins English Dictionary) tobacco - the prepared leaves of an American plant used for smoking, chewing or snuffing. (Adapted from Chambers Concise Dictionary)"
123	"Product"	515	"foodstuffs, liquid"	"any substance that a living thing feeds on, that nourishes the body; sustains or promotes growth, which is in a state where molecules move freely about one another but do not fly apart. Some foodstuffs may be consumed unprocessed, while others may undergo one or more manufacturing processes to make it palatable, or to allow mixing with other foodstuffs. (AML) specific examples include: alcohol -  an intoxicating drink formed by fermenting or distilling hydrocarbons with various fruits or grains in water. (Adapted from Webster's 3rd New International Dictionary) edible oil (extracted from plant material) -  any of various oils extracted from plants typically used in cooking. (Adapted from Chambers Concise Dictionary) milk -  a white fluid secreted by female mammals as food for their young. (Adapted from the Oxford Minidictionary, Third Edition) water - Drinking: A clear colourless liquid, devoid of taste or smell, that is a compound of hydrogen and oxygen, which is intended for human consumption. (AML)"
123	"Product"	516	"foodstuffs, preserved"	"any substance that a living thing feeds on, that nourishes the body; sustains or promotes growth which has been subjected to a process which prevents it from decaying. (AML) specific examples include: tinned food - edible substances preserved by being sealed in a tin. (Adapted from Collins English Dictionary) refrigerated/frozen cargo -  perishables that have been subjected to a degree of cold, either chilled or subjected to a temperature below freezing, in order to facilitate storage or preservation.. (Adapted from Webster's 3rd New International Dictionary)"
123	"Product"	517	"general and mixed goods"	"general; items relating to the whole or most; not specialised; of broad overall character. Mixed; characterised by scope or variety; items combined or associated. (AML) Specific examples include: furniture: movable items, either for use or ornament, with which a house is equipped. (Adapted from Chambers Concise Dictionary) government stores -  articles for a particular purpose, accumulated for use, owned by the state. (Adapted from Concise Oxford Dictionary Ninth Edition) hardware - domestic goods (esp. tools etc.) made of baser metals; equipment, mechanical or electrical. (Chambers Concise Dictionary) luxury goods -  beyond the indispensable minimum; non essential items that contribute to luxurious living; an indulgence in convenience or ornament. (Adapted from Webster's 3rd New International Dictionary) mail - letters and/or packages transported and delivered by or on behalf of a recognised postal or other carrier service. (AML) medical supplies - goods relating to the science of medicine. (AML)"
123	"Product"	519	"granular or powdery material"	"physical matter consisting of a relatively small and hard, but usually separate particles; or in a form which is dusty or easily crumbled into tiny, loose particles. (AML) Specific examples include: ash -  the powdery residue left after the burning of any substance. (Concise Oxford Dictionary Ninth Edition) cement - a fine grey powder consisting of lime and clay. When mixed with water, sand and sometimes small stones, it forms a binding or filling material commonly used for building. (AML) chalk - a white soft earthy limestone (calcium carbonate) formed from the skeletal remains of sea creatures. (Concise Oxford Dictionary Ninth Edition) clay (inc. china) -  fine-grained earth, soft when moist and hardening when baked, used to make bricks and pottery. (Adapted from Collins English Dictionary) sand - a mass of tiny rounded grains of rock. (Chambers Concise Dictionary) soil -  the upper layer of earth in which plants grow, consisting of disintegrated rock usually with a mixture of organic remains. (Concise Oxford Dictionary Ninth Edition)"
123	"Product"	520	"machinery and mechanical parts"	"machinery; apparatus usually powered by electricity designed to perform a specific task. Mechanical parts; components of vehicles or machines. (Adapted from Collins English Dictionary) Specific examples include: expellers - screw presses for expressing vegetable oil from soy beans or other seeds. (Adapted from Webster's 3rd New International Dictionary) drilling equipment - apparatus used for mining or boring operations. (Adapted from Chambers Concise Dictionary)"
123	"Product"	521	"construction materials"	"that out of which anything is, or may be made; equipment or implements. Parts that may be put together. (Adapted from Chambers Concise Dictionary) Specific examples include: coils -  products wound in circles or spirals. (Adapted from Concise Oxford Dictionary Ninth Edition) cylinders - solid or hollow bodies with straight sides and circular ends. (Adapted from Collins English Dictionary) pipes/tubes - long hollow bodies for the conveyance of water, gas, etc. (Adapted from Chambers Concise Dictionary) rods - slender bars of metal or other material. (Adapted from Chambers Concise Dictionary) wire (inc. barbed) -  a thin flexible strand of metal, barbed wire having protruding sharp points. (Adapted from Collins English Dictionary)"
123	"Product"	522	"vehicles"	"a means of conveyance or transport especially a structure with wheels in or on which people or things are transported by land. (Adapted from Chambers Concise Dictionary) Specific examples include: crawler vehicle(s) - a tractor moving on an endless caterpillar track. (Concise Oxford Dictionary 9th Edition) military vehicle(s) -  means of transport used specifically for the purposes of conducting warfare. (AML)"
123	"Product"	523	"aircraft"	"structure or machine for travelling in the air (Chambers Concise Dictionary)"
123	"Product"	524	"railway"	"stock and construction materials:  stock; engines, carriages, goods wagons or any other wheeled vehicle that can run on a track with rails. Construction materials; that out of which a railway may be made; parts that may be put together to build a railway e.g. rails; sleepers. (Adapted from Chambers Concise Dictionary)"
123	"Product"	525	"portable buildings"	"movable structures for giving shelter, normally prefabricated. (AML)"
123	"Product"	526	"containers"	"large box like receptacles of standard shape and size in which goods are enclosed for transport on a lorry, train or ship. (Adapted from Chambers Concise Dictionary)"
123	"Product"	527	"electronics"	"devices based on the technology of the conduction of electricity in a vacuum, gas or a semiconductor. (Adapted from Chambers Concise Dictionary) Note note allowable for Object Obstruction."
123	"Product"	528	"plastic"	"a large number of polymeric substances, mostly synthetic, mouldable at some stage under heat or pressure, used to make domestic articles and many engineering products. (Adapted from Chambers Concise Dictionary)"
123	"Product"	529	"paint"	"colouring matter, especially in liquid form, for imparting colour to a surface. Normally stored in small metal containers. (AML) Note note allowable for Object Obstruction."
123	"Product"	530	"refuse (also known as rubbish/garbage/trash) and waste"	"refuse; matter or materials rejected as fit only to be thrown out or away. Waste; material produced during or left over from, a manufacturing process and which is not usable for the main purpose of manufacture, but may be usable for some other purpose or in another operation. (Adapted from Webster's 3rd New International Dictionary) Note not allowable for Object Obstruction. Specific examples include: burnt ore - solid naturally-occurring mineral aggregate from which the valuable constituents have been recovered by a heat process. (Adapted from Chambers Concise Dictionary) clinker -  the incombustible residue of fused ash raked out of furnaces. (Chambers Concise Dictionary)"
123	"Product"	531	"radioactive material"	"relating to, caused by or exhibiting radioactivity; emission of radiant energy elements capable of spontaneously emitting alpha, beta or sometimes gamma rays by the disintegration of the nuclei of atoms. (Webster's 3rd New International Dictionary)"
123	"Product"	532	"armament"	"military weapons, a total means of making war; defensive equipment. (AML) Specific examples include: ammunition - a supply of projectiles, especially bullets, shells, and grenades. (Adapted from Concise Oxford Dictionary Ninth Edition) bomb/torpedo -  a hollow case containing explosive, incendiary, smoke-producing, poisonous or other offensive material.  A Torpedo is specifically  a self-propelled submarine weapon. (Adapted from Chambers Concise Dictionary) explosives - substances specifically created to blow up with violence. (Adapted from Chambers Concise Dictionary) munitions/military stores -  military weapons, ammunition, equipment, and stores. (Concise Oxford Dictionary Ninth Edition) small arms - weapons that can be carried by a person especially handguns or short weapons. (Adapted from Chambers Concise Dictionary)"
123	"Product"	533	"personnel"	"people in general (Chambers Concise Dictionary) Specific examples include: military personnel -  persons employed in the business of warfare. (Adapted from Chambers Concise Dictionary) passengers - persons travelling in a means of transport operated by others. (AML)"
123	"Product"	534	"animals (land &amp; sea) and birds"	"animals; organisms having life, sensation and voluntary movement, which require predominantly land or sea conditions for survival. Birds; warm blooded, egg laying, feathered vertebrates of the class Aves. (Adapted from Chambers Concise Dictionary) Specific examples include: livestock/animals -  organisms having life, sensation and voluntary motion.  Livestock typically being domestic animals eg. horses, cattle, sheep and pigs. (Adapted from Chambers Concise Dictionary) shark -  large elasmobranch fish with lateral gill slits and mouth on the under side. (Adapted from Chambers Concise Dictionary) whale -  large cetaceous aquatic mammal. (Adapted from Chambers Concise Dictionary) seal - amphibious mammal with flippers as limbs. (Collins English Dictionary)"
123	"Product"	535	"fish"	"a vertebrate cold-blooded animal with gills and fins living wholly in water. (Concise Oxford Dictionary Ninth Edition)"
123	"Product"	536	"shellfish and crustaceans"	"shelled aquatic invertebrates. (Chambers Concise Dictionary) Specific examples include: Scallops - A bivalve having a sub-circular shell with radiating ridges and eared hinge-line. (Chambers Concise Dictionary)"
123	"Product"	537	"ballast"	"heavy material used to weigh down and steady a ship. (Adapted from Chambers Concise Dictionary)"
123	"Product"	540	"diesel oil"	"heavy mineral oil used as fuel in diesel engines. (Webster's 3rd New International Dictionary)"
123	"Product"	541	"petrol/gasoline"	"flammable liquid obtained from petroleum, used as fuel in internal-combustion engines. (AML)"
123	"Product"	542	"passengers"	"persons travelling in a means of transport operated by others. (AML)"
125	"Quality of Sounding Measurement"	1	"depth known"	"The depth from chart datum to the bottom is a known value. (S-57 Annex A, Appendix A, IHO Object Catalogue)"
125	"Quality of Sounding Measurement"	2	"depth unknown"	"The depth from chart datum to the bottom is unknown. (S-57 Annex A, Appendix A, IHO Object Catalogue)"
125	"Quality of Sounding Measurement"	3	"doubtful sounding"	"A depth that may be less than indicated. (Adapted from IHO Dictionary, S-32, 5th Edition, 4840)"
125	"Quality of Sounding Measurement"	4	"unreliable sounding"	"A depth that is considered to be an unreliable value. (S-57 Annex A, Appendix A, IHO Object Catalogue)"
125	"Quality of Sounding Measurement"	5	"no bottom found at value shown"	"Upon investigation the bottom was not found at this depth. (Adapted from IHO Dictionary, S-32, 5th Edition, 4848)"
125	"Quality of Sounding Measurement"	6	"least depth known"	"The shoalest depth over an object is of known value. (Adapted from IHO Dictionary, S-32, 5th Edition, 2705"
125	"Quality of Sounding Measurement"	7	"least depth unknown, safe clearance at depth shown"	"The least depth over an object is unknown, but there is considered to be safe clearance at this depth. (S-57 Annex A, Appendix A, IHO Object Catalogue)"
125	"Quality of Sounding Measurement"	8	"value reported (not surveyed)"	"Depth value obtained from a report, but not fully surveyed. (S-57 Annex A, Appendix A, IHO Object Catalogue)"
125	"Quality of Sounding Measurement"	9	"value reported (not confirmed)"	"Depth Value obtained from a report, which it has not been possible to confirm. (S-57 Annex A, Appendix A, IHO Object Catalogue)"
125	"Quality of Sounding Measurement"	10	"maintained depth"	"the depth at which a channel is kept by human influence, usually by dredging. (IHO dictionary, S-32, 5th Edition, 3057)"
125	"Quality of Sounding Measurement"	11	"not regularly maintained"	"depths may be altered by human influence, but will not be routinely maintained. (S-57 Annex A, Appendix A, IHO Object Catalogue)"
131	"Restriction(s)"	1	"anchoring prohibited"	"an area within which anchoring is not permitted."
131	"Restriction(s)"	2	"anchoring restricted"	"a specified area designated by appropriate authority, within which anchoring is restricted in accordance with certain specified conditions."
131	"Restriction(s)"	3	"fishing prohibited"	"an area within which fishing is not permitted."
131	"Restriction(s)"	4	"fishing restricted"	"a specified area  designated by appropriate authority, within which fishing is restricted in accordance with certain specified conditions."
131	"Restriction(s)"	5	"trawling prohibited"	"an area within which trawling is not permitted."
131	"Restriction(s)"	6	"trawling restricted"	"a specified area designated by appropriate authority, within which trawling is restricted in accordance with certain specified conditions."
131	"Restriction(s)"	7	"entry prohibited"	"an area within which navigation and/or anchoring is prohibited. (adapted from IHO Dictionary, S-32, 5th Edition, 4044)"
131	"Restriction(s)"	8	"entry restricted"	"a specified area designated by appropriate authority, within which navigation is restricted in accordance with certain specified conditions. (adapted from IHO Dictionary, S-32, 5th Edition, 4366)"
131	"Restriction(s)"	9	"dredging prohibited"	"an area within which dredging is not permitted."
131	"Restriction(s)"	10	"dredging restricted"	"a specified area designated by appropriate authority, within which dredging is restricted in accordance with certain specified conditions."
131	"Restriction(s)"	11	"diving prohibited"	"an area within which diving is not permitted."
131	"Restriction(s)"	12	"diving restricted"	"a specified area designated by appropriate authority, within which diving is restricted in accordance with certain specified conditions."
131	"Restriction(s)"	13	"no wake"	"mariners must adjust the speed of their vessels to reduce the wave or wash which may cause erosion or disturb moored vessels."
131	"Restriction(s)"	14	"area to be avoided"	"an IMO designated area to be avoided, defined as a routeing measure. (adapted from M-4, 435.7)"
131	"Restriction(s)"	15	"construction prohibited"	"the erection of permanent or temporary fixed structures or artificial islands is prohibited."
131	"Restriction(s)"	16	"discharging prohibited"	"an area within which discharging or dumping is prohibited"
131	"Restriction(s)"	17	"discharging restricted"	"a specified area designated by an appropriate authority, within which discharging or dumping is restricted in accordance with specified conditions."
131	"Restriction(s)"	18	"industrial or mineral exploration/development prohibited"	"an area within which industrial or mineral exploration and development are prohibited."
131	"Restriction(s)"	19	"industrial or mineral exploration/development restricted"	"a specified area designated by an appropriate authority, within which industrial or mineral exploration and development is restricted in accordance with certain specified conditions."
131	"Restriction(s)"	20	"drilling prohibited"	"an area within which excavating a hole on the sea-bottom with a drill is prohibited."
131	"Restriction(s)"	21	"drilling restricted"	"a specified area designated by an appropriate authority, within which excavating a hole on the sea-bottom with a drill is restricted in accordance with certain specified conditions."
131	"Restriction(s)"	22	"removal of historical artifacts prohibited"	"an area within which the removal of historical artifacts is prohibited."
131	"Restriction(s)"	23	"cargo transhipment (lightering) prohibited"	"an area in which cargo transhipment (lightering) is prohibited."
131	"Restriction(s)"	24	"dragging prohibited"	"an area in which the dragging of anything along the bottom, e.g. bottom trawling, is prohibited."
131	"Restriction(s)"	25	"stopping prohibited"	"an area in which a vessel is prohibited from stopping."
131	"Restriction(s)"	26	"landing prohibited"	"an area in which landing is prohibited."
131	"Restriction(s)"	27	"speed restricted"	"an area within which speed is restricted."
140	"Signal Generation"	1	"automatically"	"Signal generation is initiated by a self regulating mechanism such as a timer or light sensor."
140	"Signal Generation"	2	"by wave action"	"The signal is generated by the motion of the sea surface such as a bell in a buoy."
140	"Signal Generation"	3	"by hand"	"The signal is generated by a manually operated mechanism such as a hand cranked siren."
140	"Signal Generation"	4	"by wind"	"The signal is generated by the motion of air such as a wind driven whistle."
149	"Status"	1	"permanent"	"intended to last or function indefinitely. (The Concise Oxford Dictionary, 7th Edition)"
149	"Status"	2	"occasional"	"acting on special occasions; happening irregularly. (The Concise Oxford Dictionary, 7th Edition)"
149	"Status"	3	"recommended"	"presented as worthy of confidence, acceptance, use, etc. (The Macquarie Dictionary, 1988)"
149	"Status"	4	"not in use"	"no longer used for the purpose intended; disused.(S-57 Annex A, Appendix A, Chapter 2 Attributes)"
149	"Status"	5	"periodic/intermittent"	"recurring at intervals. (The Concise Oxford Dictionary, 7th Edition)"
149	"Status"	6	"reserved"	"set apart for some specific use. (adapted from The Concise Oxford Dictionary, 7th Edition)"
149	"Status"	7	"temporary"	"meant to last only for a time. (The Concise Oxford Dictionary)"
149	"Status"	8	"private"	"not in public ownership or operation."
149	"Status"	9	"mandatory"	"compulsory; enforced. (The Concise Oxford Dictionary, 7th Edition)"
149	"Status"	11	"extinguished"	"no longer illuminated.(S-57 Annex A, Appendix A, IHO Object Catalogue)"
149	"Status"	12	"illuminated"	"lit by floodlights, strip lights, etc."
149	"Status"	13	"historic"	"famous in history; of historical interest. (The Concise Oxford Dictionary, 7th Edition)"
149	"Status"	14	"public"	"belonging to, available to, used or shared by, the community as a whole and not restricted to private use. (adapted from The New Shorter Oxford English Dictionary, 1993)"
149	"Status"	15	"synchronised"	"occur at a time, coincide in point of time, be contemporary or simultaneous. (The New Shorter Oxford English Dictionary, 1993)"
149	"Status"	16	"watched"	"looked at or observed over a period of time especially so as to be aware of any movement or change. (adapted from The New Shorter Oxford English Dictionary, 1993)"
149	"Status"	17	"un-watched"	"usually automatic in operation, without any permanently-stationed personnel to superintend it. (adapted from IHO Dictionary, S-32, 5th Edition, 2814)"
149	"Status"	18	"existence doubtful"	"an object that has been reported but has not been definitely determined to exist.(S-57 Annex A, Appendix A, Chapter 2 Attributes)"
149	"Status"	501	"active/in use"	"being used for the purpose intended; used"
149	"Status"	502	"claimed"	"a coastal State claims or may claim a specific jurisdiction in accordance with the provisions of International Law (modified IHO Dictionary, S-32, 5th Edition, 3145)"
149	"Status"	503	"practice and/or exercise purposes"	"used for military practice and/or exercise purposes only"
149	"Status"	504	"recognised"	"acknowledged and agreed in accordance with the provisions of International Law (AML)"
149	"Status"	505	"dead"	"not detected by repeated surveys, leading to doubts about the object's existence. (AML)"
149	"Status"	506	"lifted"	"an object that has been salvaged or removed. (AML)"
149	"Status"	507	"mass grave"	"where a significant number of persons have perished as a direct result of a vessel or structure sinking and their remains cannot be recovered, the wreck and immediate area may be declared as a Mass Grave or more specifically, a War Grave. Such sites are protected from disturbance by International Law. (AML)"
149	"Status"	508	"exploration"	"a borehole drilled in the search for a new source of oil or gas. (An A-Z of Offshore Oil &amp; Gas by Harry Whitehead, 2nd Ed, 1983, Gulf Publishing Company)"
149	"Status"	509	"production"	"a borehole that is actively engaged in the extraction of oil or gas from the seabed. (Adapted from An A-Z of Offshore Oil &amp; Gas by Harry Whitehead, 2nd Ed, 1983, Gulf Publishing Company)"
149	"Status"	510	"suspended"	"a well where the extraction of oil or gas has been temporarily abandoned. When suspended, a well is either plugged (filled with concrete and topped with a steel plate) or capped (well-head equipment is installed over the well). (Adapted from An A-Z of Offshore Oil &amp; Gas by Harry Whitehead, 2nd Ed, 1983, Gulf Publishing Company)"
149	"Status"	511	"injection"	"a borehole drilled for the purpose of injecting a secondary substance, for example water,  into the pore spaces in a reservoir rock to encourage oil or gas to flow into adjacent producing wells. (An A-Z of Offshore Oil &amp; Gas by Harry Whitehead, 2nd Ed, 1983, Gulf Publishing Company)"
149	"Status"	512	"unspecified"	"the status of the object is unspecified."
149	"Status"	513	"disputed"	"contended, called into question, opposed (The Concise Oxford Dictionary, 7th Edition)"
149	"Status"	514	"designated"	"a specific location where notification (upon arrival) to a specified authority is deemed mandatory. (AML)"
149	"Status"	515	"on request"	"a specific location where notification (upon arrival) to a specified authority is required when requested. (AML)"
149	"Status"	516	"dormant"	"temporarily quiet, inactive, not being used. (AML)."
149	"Status"	517	"proposed"	"planned; intended; in accordance with, or achieved by, a careful plan made beforehand (The Concise Oxford Dictionary)"
149	"Status"	518	"abandoned"	"completely deserted; given up (adapted from the Concise Oxford Dictionary)"
149	"Status"	519	"grey zone"	"area of overlap of the unilateral fishing zones of two or more countries (LOS)"
149	"Status"	520	"indeterminate"	"an area of the sea of indeterminate jurisdiction where no agreed boundary exists (LOS)"
149	"Status"	521	"multilateral"	"involving two or more states as parties to an agreement (adapted from the New Shorter Oxford English Dictionary, 1993)"
149	"Status"	522	"rules for transit passage apply"	"the international legal conditions appliccable to a vessel when navigating in territorial seas and international straits. (AML)"
149	"Status"	523	"voluntary"	
153	"Survey Type"	1	"reconnaissance/sketch survey"	"a survey made to a lower degree of accuracy and detail than the chosen scale would normally indicate. (IHO Dictionary, S-32, 5th Edition, 5219)"
153	"Survey Type"	2	"controlled survey"	"a thorough survey usually conducted with reference to guidelines"
